{
  "words": [
    {"german": "Formular", "article": "das", "plural": "Formulare", "plural_suffix": "-e", "arabic": "الاستمارة", "type": "noun", "category": "Formular", "note": null, "meta": null},
    {"german": "Name", "article": "der", "plural": "Namen", "plural_suffix": "-n", "arabic": "الاسم", "type": "noun", "category": "Formular", "note": null, "meta": null},
    {"german": "Vorname", "article": "der", "plural": "Vornamen", "plural_suffix": "-n", "arabic": "الاسم الشخصي", "type": "noun", "category": "Formular", "note": null, "meta": null},
    {"german": "Familienname", "article": "der", "plural": "Familiennamen", "plural_suffix": "-n", "arabic": "الاسم العائلي", "type": "noun", "category": "Formular", "note": null, "meta": null},
    {"german": "Nachname", "article": "der", "plural": "Nachnamen", "plural_suffix": "-n", "arabic": "اللقب / الاسم العائلي", "type": "noun", "category": "Formular", "note": null, "meta": null},
    {"german": "Straße", "article": "die", "plural": "Straßen", "plural_suffix": "-n", "arabic": "الشارع", "type": "noun", "category": "Formular", "note": null, "meta": null},
    {"german": "Hausnummer", "article": "die", "plural": "Hausnummern", "plural_suffix": "-n", "arabic": "رقم المنزل", "type": "noun", "category": "Formular", "note": null, "meta": null},
    {"german": "Nationalität", "article": "die", "plural": "Nationalitäten", "plural_suffix": "-en", "arabic": "الجنسية", "type": "noun", "category": "Formular", "note": null, "meta": null},
    {"german": "Wohnort", "article": "der", "plural": "Wohnorte", "plural_suffix": "-e", "arabic": "مكان السكن", "type": "noun", "category": "Formular", "note": null, "meta": null},
    {"german": "Vorwahl", "article": "die", "plural": "Vorwahlen", "plural_suffix": "-en", "arabic": "رمز المنطقة (الرمز الهاتفي للبلد)", "type": "noun", "category": "Formular", "note": null, "meta": null},
    {"german": "Postleitzahl (PLZ)", "article": "die", "plural": "Postleitzahlen", "plural_suffix": "-en", "arabic": "الرمز البريدي", "type": "noun", "category": "Formular", "note": null, "meta": null},
    {"german": "Telefon", "article": "das", "plural": "Telefone", "plural_suffix": "-e", "arabic": "الهاتف", "type": "noun", "category": "Formular", "note": null, "meta": null},
    {"german": "Telefonnummer", "article": "die", "plural": "Telefonnummern", "plural_suffix": "-n", "arabic": "رقم الهاتف", "type": "noun", "category": "Formular", "note": null, "meta": null},
    {"german": "Handynummer", "article": "die", "plural": "Handynummern", "plural_suffix": "-n", "arabic": "رقم الهاتف المحمول", "type": "noun", "category": "Formular", "note": null, "meta": null},
    {"german": "Handy", "article": "das", "plural": "Handys", "plural_suffix": "-s", "arabic": "الهاتف المحمول", "type": "noun", "category": "Formular", "note": null, "meta": null},
    {"german": "Adresse", "article": "die", "plural": "Adressen", "plural_suffix": "-n", "arabic": "العنوان", "type": "noun", "category": "Formular", "note": null, "meta": null},
    {"german": "E-Mail-Adresse", "article": "die", "plural": "E-Mail-Adressen", "plural_suffix": "-n", "arabic": "عنوان البريد الإلكتروني", "type": "noun", "category": "Formular", "note": null, "meta": null},

    {"german": "Sprachenzentrum", "article": "das", "plural": "Sprachenzentren", "plural_suffix": "-en", "arabic": "مركز اللغات", "type": "noun", "category": "Sprachen lernen", "note": null, "meta": null},
    {"german": "Gespräch", "article": "das", "plural": "Gespräche", "plural_suffix": "-e", "arabic": "المحادثة / الحديث", "type": "noun", "category": "Sprachen lernen", "note": null, "meta": null},
    {"german": "Kursteilnehmer", "article": "der", "plural": "Kursteilnehmer", "plural_suffix": "-", "arabic": "المشارك في الدورة (مذكر)", "type": "noun", "category": "Sprachen lernen", "note": null, "meta": null},
    {"german": "Kursteilnehmerin", "article": "die", "plural": "Kursteilnehmerinnen", "plural_suffix": "-nen", "arabic": "المشاركة في الدورة (مؤنث)", "type": "noun", "category": "Sprachen lernen", "note": null, "meta": null},
    {"german": "Sprache", "article": "die", "plural": "Sprachen", "plural_suffix": "-n", "arabic": "اللغة", "type": "noun", "category": "Sprachen lernen", "note": null, "meta": null},
    {"german": "Muttersprache", "article": "die", "plural": "Muttersprachen", "plural_suffix": "-n", "arabic": "اللغة الأم", "type": "noun", "category": "Sprachen lernen", "note": null, "meta": null},
    {"german": "Zielsprache", "article": "die", "plural": "Zielsprachen", "plural_suffix": "-n", "arabic": "اللغة المستهدفة (التي تتعلمها)", "type": "noun", "category": "Sprachen lernen", "note": null, "meta": null},
    {"german": "Tandempartner", "article": "der", "plural": "Tandempartner", "plural_suffix": "-", "arabic": "شريك التعلم المتبادل (مذكر)", "type": "noun", "category": "Sprachen lernen", "note": null, "meta": null},
    {"german": "Tandempartnerin", "article": "die", "plural": "Tandempartnerinnen", "plural_suffix": "-nen", "arabic": "شريكة التعلم المتبادل (مؤنث)", "type": "noun", "category": "Sprachen lernen", "note": null, "meta": null},
    {"german": "Sprachschule", "article": "die", "plural": "Sprachschulen", "plural_suffix": "-n", "arabic": "مدرسة اللغات", "type": "noun", "category": "Sprachen lernen", "note": null, "meta": null},
    {"german": "Kurs", "article": "der", "plural": "Kurse", "plural_suffix": "-e", "arabic": "الدورة / الدرس", "type": "noun", "category": "Sprachen lernen", "note": null, "meta": null},
    {"german": "Intensivkurs", "article": "der", "plural": "Intensivkurse", "plural_suffix": "-e", "arabic": "الدورة المكثفة", "type": "noun", "category": "Sprachen lernen", "note": null, "meta": null},
    {"german": "Vorbereitungskurs", "article": "der", "plural": "Vorbereitungskurse", "plural_suffix": "-e", "arabic": "الدورة التحضيرية", "type": "noun", "category": "Sprachen lernen", "note": null, "meta": null},
    {"german": "Sommerkurs", "article": "der", "plural": "Sommerkurse", "plural_suffix": "-e", "arabic": "الدورة الصيفية", "type": "noun", "category": "Sprachen lernen", "note": null, "meta": null},
    {"german": "lernen", "article": null, "plural": null, "plural_suffix": null, "arabic": "يتعلم", "type": "verb", "category": "Sprachen lernen", "note": null, "meta": {"irregular": false, "stem_rule": null, "modal": false}},
    {"german": "verstehen", "article": null, "plural": null, "plural_suffix": null, "arabic": "يفهم", "type": "verb", "category": "Sprachen lernen", "note": null, "meta": {"irregular": false, "stem_rule": null, "modal": false}},
    {"german": "sprechen", "article": null, "plural": null, "plural_suffix": null, "arabic": "يتكلم", "type": "verb", "category": "Sprachen lernen", "note": "unregelmäßig: du sprichst, er spricht", "meta": {"irregular": true, "stem_rule": null, "modal": false}},
    {"german": "fragen", "article": null, "plural": null, "plural_suffix": null, "arabic": "يسأل", "type": "verb", "category": "Sprachen lernen", "note": null, "meta": {"irregular": false, "stem_rule": null, "modal": false}},
    {"german": "schreiben", "article": null, "plural": null, "plural_suffix": null, "arabic": "يكتب", "type": "verb", "category": "Sprachen lernen", "note": null, "meta": {"irregular": false, "stem_rule": null, "modal": false}},
    {"german": "buchstabieren", "article": null, "plural": null, "plural_suffix": null, "arabic": "يتهجّى (يُهجّي الحروف)", "type": "verb", "category": "Sprachen lernen", "note": null, "meta": {"irregular": false, "stem_rule": null, "modal": false}},

    {"german": "Universität", "article": "die", "plural": "Universitäten", "plural_suffix": "-en", "arabic": "الجامعة", "type": "noun", "category": "Universität und Studium", "note": null, "meta": null},
    {"german": "Student", "article": "der", "plural": "Studenten", "plural_suffix": "-en", "arabic": "الطالب الجامعي", "type": "noun", "category": "Universität und Studium", "note": null, "meta": null},
    {"german": "Studentin", "article": "die", "plural": "Studentinnen", "plural_suffix": "-nen", "arabic": "الطالبة الجامعية", "type": "noun", "category": "Universität und Studium", "note": null, "meta": null},
    {"german": "Studierende", "article": "der/die", "plural": "Studierenden", "plural_suffix": "-n", "arabic": "الطالب/الطالبة (صيغة محايدة)", "type": "noun", "category": "Universität und Studium", "note": "der/die Studierende", "meta": null},
    {"german": "Professor", "article": "der", "plural": "Professoren", "plural_suffix": "-en", "arabic": "الأستاذ الجامعي", "type": "noun", "category": "Universität und Studium", "note": null, "meta": null},
    {"german": "Professorin", "article": "die", "plural": "Professorinnen", "plural_suffix": "-nen", "arabic": "الأستاذة الجامعية", "type": "noun", "category": "Universität und Studium", "note": null, "meta": null},
    {"german": "Studienfach", "article": "das", "plural": "Studienfächer", "plural_suffix": "¨-er", "arabic": "التخصص الدراسي", "type": "noun", "category": "Universität und Studium", "note": null, "meta": null},
    {"german": "Architektur", "article": "die", "plural": null, "plural_suffix": null, "arabic": "الهندسة المعمارية", "type": "noun", "category": "Universität und Studium", "note": null, "meta": null},
    {"german": "Wirtschaft(swissenschaften)", "article": "die", "plural": null, "plural_suffix": null, "arabic": "الاقتصاد (العلوم الاقتصادية)", "type": "noun", "category": "Universität und Studium", "note": "Wirtschaftswissenschaften: nur Plural (Pl.)", "meta": null},
    {"german": "Chemie", "article": "die", "plural": null, "plural_suffix": null, "arabic": "الكيمياء", "type": "noun", "category": "Universität und Studium", "note": null, "meta": null},
    {"german": "Elektrotechnik", "article": "die", "plural": null, "plural_suffix": null, "arabic": "الهندسة الكهربائية", "type": "noun", "category": "Universität und Studium", "note": null, "meta": null},